{
  "account_id": "a1000000-0000-0000-0000-000000000001",
  "context_id": "b2000000-0000-0000-0000-000000000002",
  "items": [
    {
      "account_id": "a1000000-0000-0000-0000-000000000001",
      "context_id": "b2000000-0000-0000-0000-000000000002",
      "id": "c3000000-0000-0000-0000-000000000001",
      "context_revision": 1,
      "source_kind": 1,
      "source_id": "d4000000-0000-0000-0000-000000000001",
      "reason": 1,
      "request_digest": "\\x0000000000000000000000000000000000000000000000000000000000000000",
      "revision": 1,
      "state": "pending",
      "resolution_request_id": null,
      "resolved_at": null,
      "created_at": "0001-01-01T00:00:00.000000Z"
    },
    {
      "account_id": "a1000000-0000-0000-0000-000000000001",
      "context_id": "b2000000-0000-0000-0000-000000000002",
      "id": "c3000000-0000-0000-0000-000000000002",
      "context_revision": 128,
      "source_kind": 1,
      "source_id": "d4000000-0000-0000-0000-000000000002",
      "reason": 5,
      "request_digest": "\\xffffffffffffffffffffffffffffffffffffffffffffffffffffffffffffffff",
      "revision": 2,
      "state": "resolved",
      "resolution_request_id": "e5000000-0000-0000-0000-000000000002",
      "resolved_at": "9999-12-31T23:59:59.999999Z",
      "created_at": "9999-12-31T23:59:59.999999Z"
    },
    {
      "account_id": "a1000000-0000-0000-0000-000000000001",
      "context_id": "b2000000-0000-0000-0000-000000000002",
      "id": "c3000000-0000-0000-0000-000000000003",
      "context_revision": 1,
      "source_kind": 2,
      "source_id": "d4000000-0000-0000-0000-000000000003",
      "reason": 2,
      "request_digest": "\\xa5a5a5a5a5a5a5a5a5a5a5a5a5a5a5a5a5a5a5a5a5a5a5a5a5a5a5a5a5a5a5a5",
      "revision": 1,
      "state": "pending",
      "resolution_request_id": null,
      "resolved_at": null,
      "created_at": "2000-02-29T12:34:56.123456Z"
    },
    {
      "account_id": "a1000000-0000-0000-0000-000000000001",
      "context_id": "b2000000-0000-0000-0000-000000000002",
      "id": "c3000000-0000-0000-0000-000000000004",
      "context_revision": 128,
      "source_kind": 2,
      "source_id": "d4000000-0000-0000-0000-000000000004",
      "reason": 3,
      "request_digest": "\\x5a5a5a5a5a5a5a5a5a5a5a5a5a5a5a5a5a5a5a5a5a5a5a5a5a5a5a5a5a5a5a5a",
      "revision": 2,
      "state": "resolved",
      "resolution_request_id": "e5000000-0000-0000-0000-000000000004",
      "resolved_at": "1900-02-28T23:59:59.000001Z",
      "created_at": "1900-02-28T23:59:59.000001Z"
    },
    {
      "account_id": "a1000000-0000-0000-0000-000000000001",
      "context_id": "b2000000-0000-0000-0000-000000000002",
      "id": "c3000000-0000-0000-0000-000000000005",
      "context_revision": 1,
      "source_kind": 2,
      "source_id": "d4000000-0000-0000-0000-000000000005",
      "reason": 4,
      "request_digest": "\\x0000000000000000000000000000000000000000000000000000000000000000",
      "revision": 1,
      "state": "pending",
      "resolution_request_id": null,
      "resolved_at": null,
      "created_at": "2024-02-29T00:00:00.654321Z"
    },
    {
      "account_id": "a1000000-0000-0000-0000-000000000001",
      "context_id": "b2000000-0000-0000-0000-000000000002",
      "id": "c3000000-0000-0000-0000-000000000006",
      "context_revision": 128,
      "source_kind": 1,
      "source_id": "d4000000-0000-0000-0000-000000000006",
      "reason": 1,
      "request_digest": "\\xffffffffffffffffffffffffffffffffffffffffffffffffffffffffffffffff",
      "revision": 2,
      "state": "resolved",
      "resolution_request_id": "e5000000-0000-0000-0000-000000000006",
      "resolved_at": "1999-12-31T23:30:00.123456Z",
      "created_at": "1999-12-31T23:30:00.123456Z"
    },
    {
      "account_id": "a1000000-0000-0000-0000-000000000001",
      "context_id": "b2000000-0000-0000-0000-000000000002",
      "id": "c3000000-0000-0000-0000-000000000007",
      "context_revision": 1,
      "source_kind": 1,
      "source_id": "d4000000-0000-0000-0000-000000000007",
      "reason": 5,
      "request_digest": "\\xa5a5a5a5a5a5a5a5a5a5a5a5a5a5a5a5a5a5a5a5a5a5a5a5a5a5a5a5a5a5a5a5",
      "revision": 1,
      "state": "pending",
      "resolution_request_id": null,
      "resolved_at": null,
      "created_at": "2001-01-01T00:00:00.000001Z"
    },
    {
      "account_id": "a1000000-0000-0000-0000-000000000001",
      "context_id": "b2000000-0000-0000-0000-000000000002",
      "id": "c3000000-0000-0000-0000-000000000008",
      "context_revision": 128,
      "source_kind": 2,
      "source_id": "d4000000-0000-0000-0000-000000000008",
      "reason": 2,
      "request_digest": "\\x5a5a5a5a5a5a5a5a5a5a5a5a5a5a5a5a5a5a5a5a5a5a5a5a5a5a5a5a5a5a5a5a",
      "revision": 2,
      "state": "resolved",
      "resolution_request_id": "e5000000-0000-0000-0000-000000000008",
      "resolved_at": "2400-02-29T23:59:59.999999Z",
      "created_at": "2400-02-29T23:59:59.999999Z"
    },
    {
      "account_id": "a1000000-0000-0000-0000-000000000001",
      "context_id": "b2000000-0000-0000-0000-000000000002",
      "id": "c3000000-0000-0000-0000-000000000009",
      "context_revision": 1,
      "source_kind": 2,
      "source_id": "d4000000-0000-0000-0000-000000000009",
      "reason": 3,
      "request_digest": "\\x0000000000000000000000000000000000000000000000000000000000000000",
      "revision": 1,
      "state": "pending",
      "resolution_request_id": null,
      "resolved_at": null,
      "created_at": "2100-02-28T00:00:00.000000Z"
    },
    {
      "account_id": "a1000000-0000-0000-0000-000000000001",
      "context_id": "b2000000-0000-0000-0000-000000000002",
      "id": "c3000000-0000-0000-0000-00000000000a",
      "context_revision": 128,
      "source_kind": 2,
      "source_id": "d4000000-0000-0000-0000-00000000000a",
      "reason": 4,
      "request_digest": "\\xffffffffffffffffffffffffffffffffffffffffffffffffffffffffffffffff",
      "revision": 2,
      "state": "resolved",
      "resolution_request_id": "e5000000-0000-0000-0000-00000000000a",
      "resolved_at": "0001-12-31T23:59:59.000001Z",
      "created_at": "0001-12-31T23:59:59.000001Z"
    },
    {
      "account_id": "a1000000-0000-0000-0000-000000000001",
      "context_id": "b2000000-0000-0000-0000-000000000002",
      "id": "c3000000-0000-0000-0000-00000000000b",
      "context_revision": 1,
      "source_kind": 1,
      "source_id": "d4000000-0000-0000-0000-00000000000b",
      "reason": 1,
      "request_digest": "\\xa5a5a5a5a5a5a5a5a5a5a5a5a5a5a5a5a5a5a5a5a5a5a5a5a5a5a5a5a5a5a5a5",
      "revision": 1,
      "state": "pending",
      "resolution_request_id": null,
      "resolved_at": null,
      "created_at": "9999-01-01T00:00:00.999999Z"
    },
    {
      "account_id": "a1000000-0000-0000-0000-000000000001",
      "context_id": "b2000000-0000-0000-0000-000000000002",
      "id": "c3000000-0000-0000-0000-00000000000c",
      "context_revision": 128,
      "source_kind": 1,
      "source_id": "d4000000-0000-0000-0000-00000000000c",
      "reason": 5,
      "request_digest": "\\x5a5a5a5a5a5a5a5a5a5a5a5a5a5a5a5a5a5a5a5a5a5a5a5a5a5a5a5a5a5a5a5a",
      "revision": 2,
      "state": "resolved",
      "resolution_request_id": "e5000000-0000-0000-0000-00000000000c",
      "resolved_at": "2000-01-01T00:00:00.000000Z",
      "created_at": "2000-01-01T00:00:00.000000Z"
    },
    {
      "account_id": "a1000000-0000-0000-0000-000000000001",
      "context_id": "b2000000-0000-0000-0000-000000000002",
      "id": "c3000000-0000-0000-0000-00000000000d",
      "context_revision": 1,
      "source_kind": 2,
      "source_id": "d4000000-0000-0000-0000-00000000000d",
      "reason": 2,
      "request_digest": "\\x0000000000000000000000000000000000000000000000000000000000000000",
      "revision": 1,
      "state": "pending",
      "resolution_request_id": null,
      "resolved_at": null,
      "created_at": "2004-02-29T12:00:00.333333Z"
    },
    {
      "account_id": "a1000000-0000-0000-0000-000000000001",
      "context_id": "b2000000-0000-0000-0000-000000000002",
      "id": "c3000000-0000-0000-0000-00000000000e",
      "context_revision": 128,
      "source_kind": 2,
      "source_id": "d4000000-0000-0000-0000-00000000000e",
      "reason": 3,
      "request_digest": "\\xffffffffffffffffffffffffffffffffffffffffffffffffffffffffffffffff",
      "revision": 2,
      "state": "resolved",
      "resolution_request_id": "e5000000-0000-0000-0000-00000000000e",
      "resolved_at": "2020-04-30T23:59:59.444444Z",
      "created_at": "2020-04-30T23:59:59.444444Z"
    },
    {
      "account_id": "a1000000-0000-0000-0000-000000000001",
      "context_id": "b2000000-0000-0000-0000-000000000002",
      "id": "c3000000-0000-0000-0000-00000000000f",
      "context_revision": 1,
      "source_kind": 2,
      "source_id": "d4000000-0000-0000-0000-00000000000f",
      "reason": 4,
      "request_digest": "\\xa5a5a5a5a5a5a5a5a5a5a5a5a5a5a5a5a5a5a5a5a5a5a5a5a5a5a5a5a5a5a5a5",
      "revision": 1,
      "state": "pending",
      "resolution_request_id": null,
      "resolved_at": null,
      "created_at": "2020-06-30T00:00:00.555555Z"
    },
    {
      "account_id": "a1000000-0000-0000-0000-000000000001",
      "context_id": "b2000000-0000-0000-0000-000000000002",
      "id": "c3000000-0000-0000-0000-000000000010",
      "context_revision": 128,
      "source_kind": 1,
      "source_id": "d4000000-0000-0000-0000-000000000010",
      "reason": 1,
      "request_digest": "\\x5a5a5a5a5a5a5a5a5a5a5a5a5a5a5a5a5a5a5a5a5a5a5a5a5a5a5a5a5a5a5a5a",
      "revision": 2,
      "state": "resolved",
      "resolution_request_id": "e5000000-0000-0000-0000-000000000010",
      "resolved_at": "2020-09-30T01:02:03.666666Z",
      "created_at": "2020-09-30T01:02:03.666666Z"
    },
    {
      "account_id": "a1000000-0000-0000-0000-000000000001",
      "context_id": "b2000000-0000-0000-0000-000000000002",
      "id": "c3000000-0000-0000-0000-000000000011",
      "context_revision": 1,